{"schemaVersion":"1.0","pointId":"00000000-0000-5000-8000-000000000004","samplePairId":"00000000-0000-5000-8000-000000000002","operatingCycleId":null,"assetId":"forzy-motor-01","sensorId":"s1","eventAt":"2026-08-22T12:00:00.123Z","sourceKind":"live_collection","timestampQuality":"assumed_from_retrieval","measurements":{"vibrationVelocityRms":{"value":1.1,"unit":"mm/s","semanticConfidence":"confirmed"},"vibrationAcceleration":{"value":0,"unit":"g","semanticConfidence":"confirmed","statistic":"unknown"},"temperature":{"value":30,"unit":"degC","semanticConfidence":"confirmed"}},"qualityFlags":[],"provenance":{"sourceSystem":"forzy-api","readingId":"00000000-0000-5000-8000-000000000001","scheduledAt":"2026-08-22T12:00:00.000Z","receivedAt":"2026-08-22T12:00:00.123Z","collectionPolicyId":"forzy-live-window-v1"}}
